<?xml version="1.0" encoding="UTF-8"?>
<bench4Q xmlns:xsi="http://www.w3.org/2001/XMLSchema-instance" xsi:noNamespaceSchemaLocation="src/org/bench4Q/resources/bench4Q-schema.xsd">
  <testName>testName</testName>
  <testDescription>testDescription</testDescription>
  <rbe rbetype="closed">
    <interval>1.0</interval>
    <prepair>0</prepair>
    <cooldown>10</cooldown>
    <out>out</out>
    <tolerance>0.0</tolerance>
    <retry>0</retry>
    <thinktime>0.01</thinktime>
    <urlConnectionTimeOut>0</urlConnectionTimeOut>
    <urlReadTimeOut>0</urlReadTimeOut>
    <mix>shopping</mix>
    <slow>1.0</slow>
    <getImage>false</getImage>
    <baseURL>http://localhost:8080/bench4Q</baseURL>
    <ebs>
      <baseLoad>100</baseLoad>
      <randomLoad>0</randomLoad>
      <rate>0</rate>
      <triggerTime>0</triggerTime>
      <stdyTime>60</stdyTime>
    </ebs>
  </rbe>
</bench4Q>

